{
  "$schema": "https://json-schema.org/draft/2020-12/schema",
  "$id": "https://farsight.dev/schemas/farsight-design.schema.json",
  "title": "Farsight design manifest (docs/design/screens.json)",
  "description": "The screens a product was designed with, the flows through them, and how the journeys are organised. Farsight reconciles it against the pages and components the code holds: the manifest declares intent, the graph supplies the code, and drift says where they disagree. Keys starting with $ are for editors.",
  "type": "object",
  "required": [
    "screens"
  ],
  "additionalProperties": false,
  "patternProperties": {
    "^\\$": {
      "description": "Keys starting with $ ($schema, $comment) are for editors; Farsight skips them."
    }
  },
  "properties": {
    "name": {
      "type": "string",
      "description": "What to call this design source."
    },
    "personas": {
      "type": "array",
      "description": "who the journeys are for, in the order they are shown",
      "items": {
        "$ref": "#/$defs/persona"
      }
    },
    "groups": {
      "type": "array",
      "description": "groups of journeys under a persona, in the order they are shown; one with `persona` exists under that persona only",
      "items": {
        "$ref": "#/$defs/group"
      }
    },
    "figma": {
      "type": "object",
      "additionalProperties": false,
      "properties": {
        "file": {
          "type": "string",
          "description": "The Figma file URL."
        },
        "token": {
          "type": "string",
          "description": "Where the Figma token comes from (`env:FIGMA_TOKEN`) — never the token itself."
        }
      }
    },
    "screens": {
      "type": "array",
      "items": {
        "$ref": "#/$defs/screen"
      }
    },
    "flows": {
      "type": "array",
      "items": {
        "$ref": "#/$defs/flow"
      }
    },
    "surfaces": {
      "type": "array",
      "description": "The product surfaces the docs scope, with or without screens — a surface nobody has drawn yet is still a row.",
      "items": {
        "type": "object",
        "required": [
          "id",
          "name"
        ],
        "additionalProperties": false,
        "properties": {
          "id": {
            "type": "string",
            "description": "The surface's id."
          },
          "name": {
            "type": "string",
            "description": "What it is called."
          },
          "status": {
            "enum": [
              "built",
              "partly built",
              "not started"
            ]
          },
          "description": {
            "type": "string",
            "description": "One sentence on it."
          }
        }
      }
    },
    "storylines": {
      "type": "array",
      "description": "journeys told one after another as one story",
      "items": {
        "type": "object",
        "description": "A storyline: journeys told one after another as one story, in the order listed.",
        "required": [
          "id",
          "name",
          "journeys"
        ],
        "additionalProperties": false,
        "properties": {
          "id": {
            "type": "string",
            "description": "The storyline's id."
          },
          "name": {
            "type": "string",
            "description": "What the storyline is called."
          },
          "description": {
            "type": "string",
            "description": "One or two sentences on what the story is."
          },
          "journeys": {
            "type": "array",
            "description": "Flow ids, in the order the story tells them; an entry written as an object with branchOf and when is a branch off that step.",
            "items": {
              "anyOf": [
                {
                  "type": "string"
                },
                {
                  "$ref": "#/$defs/storylineEntry"
                }
              ]
            }
          },
          "lanes": {
            "type": "array",
            "description": "The lanes the swimlane layout names or overrides (a list given in config replaces the manifest's).",
            "items": {
              "$ref": "#/$defs/storylineLane"
            }
          },
          "handoffs": {
            "type": "array",
            "description": "Hand-offs the swimlane layout draws when the graph finds both ends (a list given in config replaces the manifest's).",
            "items": {
              "$ref": "#/$defs/storylineHandoff"
            }
          }
        }
      }
    },
    "decisions": {
      "type": "array",
      "description": "decisions the team made or left open, in its own words: joined to the code by DECISION(<id>) comments and printed as declarations, never as evidence. An id two manifests declare with different titles is a note; the first manifest read keeps it.",
      "items": {
        "$ref": "#/$defs/decision"
      }
    }
  },
  "$defs": {
    "persona": {
      "type": "object",
      "required": [
        "id",
        "name"
      ],
      "additionalProperties": false,
      "properties": {
        "id": {
          "type": "string",
          "description": "The persona's id."
        },
        "name": {
          "type": "string",
          "description": "Who they are."
        },
        "description": {
          "type": "string",
          "description": "One sentence on them."
        },
        "routes": {
          "type": "array",
          "description": "route globs this persona's screens live under (/ops/**): a screen whose route matches is drawn in this persona's lane unless its own row names a persona; the most specific glob wins",
          "items": {
            "type": "string"
          }
        },
        "signsInWith": {
          "type": "array",
          "description": "the guards that sign this persona in, by name or node id: a screen whose code meets only these is this persona's",
          "items": {
            "type": "string"
          }
        }
      }
    },
    "group": {
      "type": "object",
      "required": [
        "id",
        "name"
      ],
      "additionalProperties": false,
      "properties": {
        "id": {
          "type": "string",
          "description": "The group's id."
        },
        "name": {
          "type": "string",
          "description": "What the group is called."
        },
        "description": {
          "type": "string",
          "description": "One sentence on it."
        },
        "persona": {
          "type": "string",
          "description": "The persona it exists under only; absent = under every persona with a journey in it."
        }
      }
    },
    "screen": {
      "type": "object",
      "required": [
        "id"
      ],
      "additionalProperties": false,
      "properties": {
        "id": {
          "type": "string",
          "description": "the name the docs use — \"SCR-07\""
        },
        "name": {
          "type": "string",
          "description": "What the screen is called."
        },
        "route": {
          "type": "string",
          "description": "the page's identity: the route path, spelled any way (`/track/[token]`, `/track/{token}`, `/track/:token`)"
        },
        "component": {
          "type": "string",
          "description": "a component's name, for a screen that is not a page"
        },
        "nodeId": {
          "type": "string",
          "description": "Figma node id (\"26-9\" or \"26:9\"), or a URL carrying `node-id`"
        },
        "url": {
          "type": "string",
          "description": "A link to the screen's design."
        },
        "image": {
          "type": "string",
          "description": "repo-relative image (png/jpg/svg/webp) — a reference; the server serves it path-confined"
        },
        "operations": {
          "type": "array",
          "description": "operationIds the design says this screen uses",
          "items": {
            "type": "string"
          }
        },
        "phase": {
          "type": "string",
          "description": "The delivery phase it belongs to."
        },
        "description": {
          "type": "string",
          "description": "One or two sentences on the screen."
        },
        "steps": {
          "type": "array",
          "description": "The numbered steps a screen's spec and its tests refer to — `SCR-07.2`. A step with `by` is done outside the code.",
          "items": {
            "type": "object",
            "required": [
              "id",
              "name"
            ],
            "additionalProperties": false,
            "properties": {
              "id": {
                "type": "string",
                "description": "The step id."
              },
              "name": {
                "type": "string",
                "description": "What the step is."
              },
              "operation": {
                "type": "string",
                "description": "The operationId the step uses."
              },
              "by": {
                "enum": [
                  "person",
                  "partner",
                  "external"
                ],
                "description": "Done outside the code, on purpose: by a person, a partner, or another system the app does not call. Drawn apart from a screen that is designed and not built; never a gate, never a verdict."
              },
              "who": {
                "type": "string",
                "description": "Who does it, in the team's words — or a persona id, or the name of a party external."
              },
              "where": {
                "type": "string",
                "description": "Where it happens, in the team's words (by email, in the ERP)."
              }
            }
          }
        },
        "work": {
          "type": "array",
          "description": "work items it is for (Jira keys, Azure DevOps ids) — a declared tracks link",
          "items": {
            "type": "string"
          }
        },
        "persona": {
          "type": "string",
          "description": "who uses this screen — a persona id or name from personas[]; it wins over a persona's routes, the sign-in guard its code meets and its journey's persona"
        }
      }
    },
    "flow": {
      "type": "object",
      "required": [
        "id",
        "name",
        "screens"
      ],
      "additionalProperties": false,
      "description": "A named user flow — a feature the business names: an ordered set of screens, the documents that describe it, the operations it spans. Becomes a flow node and a journey entry.",
      "properties": {
        "id": {
          "type": "string",
          "description": "The flow's id."
        },
        "name": {
          "type": "string",
          "description": "What the business calls it."
        },
        "description": {
          "type": "string",
          "description": "One or two sentences on it."
        },
        "screens": {
          "type": "array",
          "description": "screen ids, in the order a person meets them",
          "items": {
            "type": "string"
          }
        },
        "docs": {
          "type": "array",
          "description": "repo-relative documents (ADRs, product docs) or URLs that describe the flow",
          "items": {
            "type": "string"
          }
        },
        "operations": {
          "type": "array",
          "description": "operationIds the flow spans beyond what its screens list",
          "items": {
            "type": "string"
          }
        },
        "phase": {
          "type": "string",
          "description": "The delivery phase it belongs to."
        },
        "requires": {
          "type": "array",
          "description": "flow ids that must happen before this one",
          "items": {
            "type": "string"
          }
        },
        "leadsTo": {
          "type": "array",
          "description": "flow ids that follow this one",
          "items": {
            "type": "string"
          }
        },
        "persona": {
          "description": "who this flow is for — a persona id or name from personas[], or several; a value no personas[] entry declares is a persona of its own",
          "anyOf": [
            {
              "type": "string"
            },
            {
              "type": "array",
              "items": {
                "type": "string"
              }
            }
          ]
        },
        "owner": {
          "type": "string",
          "description": "who answers for it; absent prints as an absence word, never a guess"
        },
        "group": {
          "type": "string",
          "description": "the group it sits in under its persona(s) — a groups[] id or name; absent = the persona's Other journeys"
        },
        "order": {
          "type": "number",
          "description": "its place in the group, ascending; ties and absences keep the order the flows are written in"
        },
        "work": {
          "type": "array",
          "description": "work items it is for (Jira keys, Azure DevOps ids) — a declared tracks link",
          "items": {
            "type": "string"
          }
        }
      }
    },
    "storylineEntry": {
      "type": "object",
      "description": "One entry of a storyline's journeys written as an object. With only an id it is a step, like a bare flow id. With branchOf it is a branch: a journey a case takes only when the condition in when holds, leaving the storyline at the step branchOf names and, when rejoins names a step, coming back there. A branch is declared, never guessed from the code.",
      "required": [
        "id"
      ],
      "additionalProperties": false,
      "properties": {
        "id": {
          "type": "string",
          "description": "The flow id of the journey."
        },
        "branchOf": {
          "type": "string",
          "description": "The step of this storyline (a flow id in its journeys) the branch leaves from."
        },
        "when": {
          "type": "string",
          "description": "The condition that takes a case down the branch, in words. Required for a branch: one without it is a note and is not drawn."
        },
        "rejoins": {
          "type": "string",
          "description": "The step of this storyline the branch comes back to; leave it out when the case leaves the storyline there."
        }
      }
    },
    "storylineLane": {
      "type": "object",
      "description": "One lane of the storyline's swimlane layout, named by the design. Lanes are derived from the graph — one per persona who owns a journey of the storyline and one per store its code writes to — so an entry only names, orders or adds a second line to one. Give exactly one of persona or store. An entry the graph cannot find is a note, never a lane.",
      "required": [
        "id"
      ],
      "additionalProperties": false,
      "properties": {
        "id": {
          "type": "string",
          "description": "The lane's id; a hand-off may name it."
        },
        "persona": {
          "type": "string",
          "description": "A declared persona id: the lane of that kind of person."
        },
        "store": {
          "type": "string",
          "description": "A store's name as the code or the config gives it: the lane of that store."
        },
        "surface": {
          "type": "string",
          "description": "Where that person works, a second line under the lane's name."
        },
        "name": {
          "type": "string",
          "description": "The word the lane is printed under, in place of the persona's or the store's."
        }
      },
      "oneOf": [
        {
          "required": [
            "persona"
          ]
        },
        {
          "required": [
            "store"
          ]
        }
      ]
    },
    "storylineHandoff": {
      "type": "object",
      "description": "A hand-off the swimlane layout draws when the graph finds both ends. Each end is a lane (its id, a persona id or a store name) or a screen written journey-id#n (the n-th screen of that journey of the storyline, from 1). kind moves: the screen moves the record into status in a store lane. kind seen: a screen in another lane reads the record in status. One the graph cannot find is a note, never an arrow.",
      "required": [
        "from",
        "to",
        "kind"
      ],
      "additionalProperties": false,
      "properties": {
        "from": {
          "type": "string",
          "description": "Where the hand-off starts: a screen (journey-id#n) for moves, a store lane for seen."
        },
        "to": {
          "type": "string",
          "description": "Where it ends: a store lane for moves, a screen (journey-id#n) for seen."
        },
        "kind": {
          "enum": [
            "moves",
            "seen"
          ],
          "description": "moves: the screen's action moves the record. seen: the screen shows the record in that status without the person doing anything."
        },
        "status": {
          "type": "string",
          "description": "The status as the code spells it. Required for moves; a seen hand-off without one is a note."
        },
        "when": {
          "type": "string",
          "description": "A label for the arrow, in words."
        }
      }
    },
    "decision": {
      "type": "object",
      "description": "One decision: the team's own words for a choice it made or left open.",
      "required": [
        "id",
        "title",
        "state"
      ],
      "additionalProperties": false,
      "properties": {
        "id": {
          "type": "string",
          "description": "The id the team and the code use (`D7`, `OBD-D7`); a `DECISION(<id>)` comment in code names it."
        },
        "title": {
          "type": "string",
          "description": "The decision as a question or a statement, in the team's words."
        },
        "state": {
          "enum": [
            "open",
            "decided"
          ],
          "description": "open = not decided yet; decided = made."
        },
        "decided": {
          "type": "string",
          "pattern": "^\\d{4}-\\d{2}-\\d{2}$",
          "description": "The date it was decided (YYYY-MM-DD)."
        },
        "owner": {
          "type": "string",
          "description": "Who owns the decision."
        },
        "summary": {
          "type": "string",
          "description": "The team's words on it, quoted as written."
        },
        "doc": {
          "type": "string",
          "description": "A source-relative markdown document, optionally with #anchor; its heading and first paragraph are quoted."
        },
        "affects": {
          "type": "array",
          "description": "Node ids, screen ids or flow ids the decision bears on.",
          "items": {
            "type": "string"
          }
        }
      }
    }
  }
}
