{
  "name": "NX example — screens",
  "groups": [
    {
      "id": "invoices",
      "name": "Invoices",
      "description": "Reading what is owed.",
      "persona": "billing"
    },
    {
      "id": "runs",
      "name": "Overnight runs",
      "description": "Checking what the overnight run collected.",
      "persona": "ops"
    }
  ],
  "storylines": [
    {
      "id": "billing-day",
      "name": "A billing day",
      "description": "Billing signs in and reads what is owed; Operations signs in and checks what the overnight run collected.",
      "journeys": [
        "billing-sign-in",
        "review-open-invoices",
        "ops-sign-in",
        "check-report-runs"
      ]
    }
  ],
  "screens": [
    {
      "id": "BIL-01",
      "name": "Open invoices",
      "route": "/invoices",
      "description": "The open invoices of the billing domain, with their amounts."
    },
    {
      "id": "OPS-01",
      "name": "Overnight run",
      "route": "/runs",
      "description": "The overnight run: how much was collected today."
    }
  ],
  "flows": [
    {
      "id": "review-open-invoices",
      "name": "Review open invoices",
      "description": "A billing user opens the list of open invoices and reads what is owed.",
      "persona": "billing",
      "group": "invoices",
      "screens": [
        "BIL-01"
      ]
    },
    {
      "id": "check-report-runs",
      "name": "Check the overnight run",
      "description": "An operations user checks how much the overnight run collected.",
      "persona": "ops",
      "group": "runs",
      "screens": [
        "OPS-01"
      ]
    }
  ]
}
