{
  "name": "Invoice app — screens",
  "figma": {
    "file": "https://www.figma.com/design/INVOICEAPPDEMO0000/Invoice-app"
  },
  "personas": [
    {
      "id": "billing",
      "name": "Billing",
      "description": "The people who draft invoices and send them to customers.",
      "routes": [
        "/invoices/new"
      ]
    },
    {
      "id": "ops",
      "name": "Operations",
      "description": "The team that reviews drafts before they go out."
    }
  ],
  "groups": [
    {
      "id": "invoices",
      "name": "Invoices",
      "description": "Starting an invoice and running the whole cycle."
    },
    {
      "id": "review",
      "name": "Review and send",
      "description": "Checking a draft and sending it, or discarding it."
    }
  ],
  "storylines": [
    {
      "id": "invoice",
      "name": "An invoice, end to end",
      "description": "From a new invoice to a sent one, and the whole cycle around it.",
      "journeys": [
        "new-invoice",
        "billing-cycle",
        {
          "id": "draft-and-send",
          "branchOf": "new-invoice",
          "when": "Operations reviews the draft before it is sent",
          "rejoins": "billing-cycle"
        }
      ]
    }
  ],
  "decisions": [
    {
      "id": "D1",
      "title": "Does an invoice above a limit need a second approver?",
      "state": "open",
      "owner": "Operations lead",
      "summary": "One person with the billing admin scope approves any invoice today; a second approver above a limit is asked for and not decided.",
      "doc": "docs/decisions/0001-approval-limits.md",
      "affects": [
        "INV-01"
      ]
    }
  ],
  "screens": [
    {
      "id": "INV-01",
      "name": "Invoice list",
      "route": "/invoices",
      "nodeId": "1-2",
      "image": "docs/design/inv-01.svg",
      "operations": [
        "listInvoices",
        "createInvoice",
        "getInvoice",
        "updateInvoice"
      ],
      "phase": "1",
      "description": "Every invoice, newest first, with its status and a way into the draft editor.",
      "steps": [
        {
          "id": "INV-01.1",
          "name": "The customer pays the sent invoice by bank transfer",
          "by": "partner",
          "who": "Customer bank",
          "where": "outside the app, by bank transfer"
        }
      ]
    },
    {
      "id": "INV-02",
      "name": "New invoice",
      "route": "/invoices/new",
      "nodeId": "1-3",
      "image": "docs/design/inv-02.svg",
      "operations": [
        "createInvoice",
        "getInvoice"
      ],
      "phase": "1",
      "description": "Draft a new invoice for a customer: pick the customer, add line items, save."
    },
    {
      "id": "INV-03",
      "name": "Discard draft",
      "route": "/invoices/[id]/discard",
      "persona": "ops",
      "nodeId": "1-4",
      "operations": [
        "deleteInvoice"
      ],
      "phase": "2",
      "description": "Confirm and discard a draft invoice that will never be sent."
    },
    {
      "id": "INV-04",
      "name": "Get paid",
      "route": "/invoices/[id]/pay",
      "operations": [
        "recordPaymentIntent",
        "markInvoicePaid"
      ],
      "phase": "2",
      "description": "Record how an invoice will be paid, then mark it paid when the bank confirms."
    }
  ],
  "flows": [
    {
      "id": "billing-cycle",
      "name": "Billing cycle",
      "description": "The whole cycle: start a new invoice, review it in the list, discard drafts that will never be sent.",
      "persona": "billing",
      "group": "invoices",
      "order": 1,
      "screens": [
        "INV-02",
        "INV-01",
        "INV-03"
      ],
      "docs": [
        "docs/design/flows.md"
      ],
      "phase": "1"
    },
    {
      "id": "new-invoice",
      "name": "Start a new invoice",
      "description": "A billing user drafts an invoice for a customer: pick the customer, add line items, save.",
      "persona": "billing",
      "group": "invoices",
      "order": 2,
      "screens": [
        "INV-02"
      ],
      "operations": [
        "createInvoice"
      ],
      "phase": "1",
      "leadsTo": [
        "draft-and-send"
      ]
    },
    {
      "id": "draft-and-send",
      "name": "Draft and send an invoice",
      "description": "A billing user reviews a draft in the list, and can discard a draft that will never be sent.",
      "persona": [
        "billing",
        "ops"
      ],
      "group": "invoices",
      "screens": [
        "INV-01",
        "INV-03"
      ],
      "docs": [
        "docs/design/flows.md",
        "docs/decisions/0001-approval-limits.md"
      ],
      "operations": [
        "listInvoices",
        "deleteInvoice"
      ],
      "phase": "1"
    },
    {
      "id": "get-paid",
      "name": "Get paid",
      "description": "Operations plans the payment of an invoice and marks it paid when the money arrives.",
      "persona": "ops",
      "group": "review",
      "screens": [
        "INV-04"
      ],
      "operations": [
        "recordPaymentIntent",
        "markInvoicePaid"
      ],
      "phase": "2"
    }
  ]
}
